name,spanKind,statusCode,start_time,parent_id,latency_ms,context.trace_id,context.span_id,attributes.session.id,attributes.openinference.span.kind,totalTokenCount,attributes.input.value,attributes.output.value,attributes.llm.token_count.total,attributes.llm.token_count.prompt,:arize-computed:tokenization.prompt.encoder,:arize-computed:tokenization.prompt.method,attributes.llm.token_count.completion,:arize-computed:tokenization.completion.encoder,:arize-computed:tokenization.completion.method,status_code
ChatCompletion,LLM,OK,2025-08-11T23:57:43.169Z,,3320.783,f59b9701206c8f837d07a2f81b6c1bff,92d2e13bae7e8251,,LLM,712,"{""messages"": [{""role"": ""system"", ""content"": ""You are an expert at classifying user intents for a travel planning assistant.\n\nAvailable intent categories:\n- flight_only: User wants flight search/booking only\n- hotel_only: User wants hotel search/booking only  \n- full_trip: User wants complete trip planning (flights + hotels + itinerary)\n- information: User wants general travel information (weather, events, etc.)\n- greeting: User is greeting or starting conversation\n- clarification_needed: Request is too vague and needs more information\n- unknown: Cannot determine intent\n\nYour task is to:\n1. Classify the user's intent\n2. Extract relevant entities (dates, locations, preferences, etc.)\n3. Provide confidence score (0.0-1.0)\n4. Give reasoning for your classification\n5. Suggest follow-up questions if clarification is needed\n\nPrevious conversation context:\nUser: What\nAssistant: I'd like to help you with your travel plans, but I need a bit more information. Can you please provide more details? Are you looking for flight or hotel information? Do you need information about a specific location?\nUser: Yeah I wanna travel to Tokyo\n\n\nClassification examples:\nExample 1:\nInput: I need to book a flight from New York to Los Angeles next week\nOutput: {\""intent\"": \""flight_only\"", \""confidence\"": 0.95, \""entities\"": {\""origin\"": \""New York\"", \""destination\"": \""Los Angeles\"", \""time\"": \""next week\""}}\n\nExample 2:\nInput: Find me a hotel in San Francisco for 3 nights in December\nOutput: {\""intent\"": \""hotel_only\"", \""confidence\"": 0.92, \""entities\"": {\""location\"": \""San Francisco\"", \""duration\"": \""3 nights\"", \""time\"": \""December\""}}\n\nExample 3:\nInput: Plan a complete trip to Europe including flights and hotels\nOutput: {\""intent\"": \""full_trip\"", \""confidence\"": 0.98, \""entities\"": {\""destination\"": \""Europe\"", \""includes\"": [\""flights\"", \""hotels\""]}}\n\nExample 4:\nInput: What's the weather like in Tokyo in March?\nOutput: {\""intent\"": \""information\"", \""confidence\"": 0.89, \""entities\"": {\""location\"": \""Tokyo\"", \""topic\"": \""weather\"", \""time\"": \""March\""}}\n\nExample 5:\nInput: Hello, I'm looking for travel help\nOutput: {\""intent\"": \""greeting\"", \""confidence\"": 0.85, \""entities\"": {\""topic\"": \""travel\""}}\n\n\n\nRespond with valid JSON in this exact format:\n{\n    \""intent\"": \""intent_name\"",\n    \""confidence\"": 0.95,\n    \""entities\"": {\n        \""key\"": \""value\""\n    },\n    \""reasoning\"": \""Brief explanation of classification\"",\n    \""follow_up_questions\"": [\""question1\"", \""question2\""]\n}""}, {""role"": ""user"", ""content"": ""Classify this user message: Yeah I wanna travel to Tokyo""}], ""model"": ""gpt-4"", ""max_tokens"": 500, ""temperature"": 0.1}","{""id"":""chatcmpl-C3WgZqk0Bcbytv8JVVk17LzyeQmHE"",""choices"":[{""finish_reason"":""stop"",""index"":0,""logprobs"":null,""message"":{""content"":""{\n    \""intent\"": \""clarification_needed\"",\n    \""confidence\"": 0.6,\n    \""entities\"": {\n        \""destination\"": \""Tokyo\""\n    },\n    \""reasoning\"": \""While the user has mentioned a destination, they have not specified what kind of travel assistance they need (flights, hotels, full trip planning, etc.).\"",\n    \""follow_up_questions\"": [\""Do you need help with booking flights, hotels, or both?\"", \""When are you planning to travel?\"", \""How long do you plan to stay in Tokyo?\""]\n}"",""refusal"":null,""role"":""assistant"",""annotations"":[]}}],""created"":1754956663,""model"":""gpt-4-0613"",""object"":""chat.completion"",""service_tier"":""default"",""system_fingerprint"":null,""usage"":{""completion_tokens"":113,""prompt_tokens"":599,""total_tokens"":712,""completion_tokens_details"":{""accepted_prediction_tokens"":0,""audio_tokens"":0,""reasoning_tokens"":0,""rejected_prediction_tokens"":0},""prompt_tokens_details"":{""audio_tokens"":0,""cached_tokens"":0}}}",712,599,--,user-provided,113,--,user-provided,OK
ChatCompletion,LLM,OK,2025-08-11T23:57:29.400Z,,4196.717,4e10689a0960ead5be2a4c3a6b391ea9,a14fa3bd1da1e663,,LLM,624,"{""messages"": [{""role"": ""system"", ""content"": ""You are an expert at classifying user intents for a travel planning assistant.\n\nAvailable intent categories:\n- flight_only: User wants flight search/booking only\n- hotel_only: User wants hotel search/booking only  \n- full_trip: User wants complete trip planning (flights + hotels + itinerary)\n- information: User wants general travel information (weather, events, etc.)\n- greeting: User is greeting or starting conversation\n- clarification_needed: Request is too vague and needs more information\n- unknown: Cannot determine intent\n\nYour task is to:\n1. Classify the user's intent\n2. Extract relevant entities (dates, locations, preferences, etc.)\n3. Provide confidence score (0.0-1.0)\n4. Give reasoning for your classification\n5. Suggest follow-up questions if clarification is needed\n\nPrevious conversation context:\nUser: What\n\n\nClassification examples:\nExample 1:\nInput: I need to book a flight from New York to Los Angeles next week\nOutput: {\""intent\"": \""flight_only\"", \""confidence\"": 0.95, \""entities\"": {\""origin\"": \""New York\"", \""destination\"": \""Los Angeles\"", \""time\"": \""next week\""}}\n\nExample 2:\nInput: Find me a hotel in San Francisco for 3 nights in December\nOutput: {\""intent\"": \""hotel_only\"", \""confidence\"": 0.92, \""entities\"": {\""location\"": \""San Francisco\"", \""duration\"": \""3 nights\"", \""time\"": \""December\""}}\n\nExample 3:\nInput: Plan a complete trip to Europe including flights and hotels\nOutput: {\""intent\"": \""full_trip\"", \""confidence\"": 0.98, \""entities\"": {\""destination\"": \""Europe\"", \""includes\"": [\""flights\"", \""hotels\""]}}\n\nExample 4:\nInput: What's the weather like in Tokyo in March?\nOutput: {\""intent\"": \""information\"", \""confidence\"": 0.89, \""entities\"": {\""location\"": \""Tokyo\"", \""topic\"": \""weather\"", \""time\"": \""March\""}}\n\nExample 5:\nInput: Hello, I'm looking for travel help\nOutput: {\""intent\"": \""greeting\"", \""confidence\"": 0.85, \""entities\"": {\""topic\"": \""travel\""}}\n\n\n\nRespond with valid JSON in this exact format:\n{\n    \""intent\"": \""intent_name\"",\n    \""confidence\"": 0.95,\n    \""entities\"": {\n        \""key\"": \""value\""\n    },\n    \""reasoning\"": \""Brief explanation of classification\"",\n    \""follow_up_questions\"": [\""question1\"", \""question2\""]\n}""}, {""role"": ""user"", ""content"": ""Classify this user message: What""}], ""model"": ""gpt-4"", ""max_tokens"": 500, ""temperature"": 0.1}","{""id"":""chatcmpl-C3WgLChxMgNOPMTIPMcAGJJgroZQb"",""choices"":[{""finish_reason"":""stop"",""index"":0,""logprobs"":null,""message"":{""content"":""{\n    \""intent\"": \""clarification_needed\"",\n    \""confidence\"": 0.99,\n    \""entities\"": {},\n    \""reasoning\"": \""The user's message is too vague and does not provide enough information to determine a specific intent.\"",\n    \""follow_up_questions\"": [\""Can you please provide more details?\"", \""Are you looking for flight or hotel information?\"", \""Do you need information about a specific location?\""]\n}"",""refusal"":null,""role"":""assistant"",""annotations"":[]}}],""created"":1754956649,""model"":""gpt-4-0613"",""object"":""chat.completion"",""service_tier"":""default"",""system_fingerprint"":null,""usage"":{""completion_tokens"":85,""prompt_tokens"":539,""total_tokens"":624,""completion_tokens_details"":{""accepted_prediction_tokens"":0,""audio_tokens"":0,""reasoning_tokens"":0,""rejected_prediction_tokens"":0},""prompt_tokens_details"":{""audio_tokens"":0,""cached_tokens"":0}}}",624,539,--,user-provided,85,--,user-provided,OK
ChatCompletion,LLM,OK,2025-08-11T23:37:53.754Z,,5227.323,2a7d26ae361aa847a45506705a7e332b,471df86e324a3748,,LLM,732,"{""messages"": [{""role"": ""system"", ""content"": ""You are an expert at classifying user intents for a travel planning assistant.\n\nAvailable intent categories:\n- flight_only: User wants flight search/booking only\n- hotel_only: User wants hotel search/booking only  \n- full_trip: User wants complete trip planning (flights + hotels + itinerary)\n- information: User wants general travel information (weather, events, etc.)\n- greeting: User is greeting or starting conversation\n- clarification_needed: Request is too vague and needs more information\n- unknown: Cannot determine intent\n\nYour task is to:\n1. Classify the user's intent\n2. Extract relevant entities (dates, locations, preferences, etc.)\n3. Provide confidence score (0.0-1.0)\n4. Give reasoning for your classification\n5. Suggest follow-up questions if clarification is needed\n\nPrevious conversation context:\nAssistant: I'd love to help you plan a complete trip! Where are you thinking of going, and when would you like to travel?\nUser: I wanna go to tokyo for a week on 8/25\nAssistant: Wonderful! I'll help you plan a complete trip to Tokyo. This will include flights, hotels, and a suggested itinerary. Let me gather some information to create the perfect trip for you.\nUser: Proceed\n\n\nClassification examples:\nExample 1:\nInput: I need to book a flight from New York to Los Angeles next week\nOutput: {\""intent\"": \""flight_only\"", \""confidence\"": 0.95, \""entities\"": {\""origin\"": \""New York\"", \""destination\"": \""Los Angeles\"", \""time\"": \""next week\""}}\n\nExample 2:\nInput: Find me a hotel in San Francisco for 3 nights in December\nOutput: {\""intent\"": \""hotel_only\"", \""confidence\"": 0.92, \""entities\"": {\""location\"": \""San Francisco\"", \""duration\"": \""3 nights\"", \""time\"": \""December\""}}\n\nExample 3:\nInput: Plan a complete trip to Europe including flights and hotels\nOutput: {\""intent\"": \""full_trip\"", \""confidence\"": 0.98, \""entities\"": {\""destination\"": \""Europe\"", \""includes\"": [\""flights\"", \""hotels\""]}}\n\nExample 4:\nInput: What's the weather like in Tokyo in March?\nOutput: {\""intent\"": \""information\"", \""confidence\"": 0.89, \""entities\"": {\""location\"": \""Tokyo\"", \""topic\"": \""weather\"", \""time\"": \""March\""}}\n\nExample 5:\nInput: Hello, I'm looking for travel help\nOutput: {\""intent\"": \""greeting\"", \""confidence\"": 0.85, \""entities\"": {\""topic\"": \""travel\""}}\n\n\n\nRespond with valid JSON in this exact format:\n{\n    \""intent\"": \""intent_name\"",\n    \""confidence\"": 0.95,\n    \""entities\"": {\n        \""key\"": \""value\""\n    },\n    \""reasoning\"": \""Brief explanation of classification\"",\n    \""follow_up_questions\"": [\""question1\"", \""question2\""]\n}""}, {""role"": ""user"", ""content"": ""Classify this user message: Proceed""}], ""model"": ""gpt-4"", ""max_tokens"": 500, ""temperature"": 0.1}","{""id"":""chatcmpl-C3WNOYLKFcE1eMrwtjNyrXZOwE0iv"",""choices"":[{""finish_reason"":""stop"",""index"":0,""logprobs"":null,""message"":{""content"":""{\n    \""intent\"": \""full_trip\"",\n    \""confidence\"": 0.85,\n    \""entities\"": {},\n    \""reasoning\"": \""The user has previously expressed a desire to plan a full trip to Tokyo, and their use of the word 'Proceed' indicates they are ready to continue with this process.\"",\n    \""follow_up_questions\"": [\""Do you have any specific places in Tokyo you'd like to visit?\"", \""What's your budget for the trip?\"", \""Do you have any preferences for your flight or hotel?\""]\n}"",""refusal"":null,""role"":""assistant"",""annotations"":[]}}],""created"":1754955474,""model"":""gpt-4-0613"",""object"":""chat.completion"",""service_tier"":""default"",""system_fingerprint"":null,""usage"":{""completion_tokens"":107,""prompt_tokens"":625,""total_tokens"":732,""completion_tokens_details"":{""accepted_prediction_tokens"":0,""audio_tokens"":0,""reasoning_tokens"":0,""rejected_prediction_tokens"":0},""prompt_tokens_details"":{""audio_tokens"":0,""cached_tokens"":0}}}",732,625,--,user-provided,107,--,user-provided,OK
ChatCompletion,LLM,OK,2025-08-11T23:37:39.223Z,,3768.373,c336db92aaa16a943e550da154e9cf3a,0341cb9a6c4dd8e3,,LLM,770,"{""messages"": [{""role"": ""system"", ""content"": ""You are an expert at classifying user intents for a travel planning assistant.\n\nAvailable intent categories:\n- flight_only: User wants flight search/booking only\n- hotel_only: User wants hotel search/booking only  \n- full_trip: User wants complete trip planning (flights + hotels + itinerary)\n- information: User wants general travel information (weather, events, etc.)\n- greeting: User is greeting or starting conversation\n- clarification_needed: Request is too vague and needs more information\n- unknown: Cannot determine intent\n\nYour task is to:\n1. Classify the user's intent\n2. Extract relevant entities (dates, locations, preferences, etc.)\n3. Provide confidence score (0.0-1.0)\n4. Give reasoning for your classification\n5. Suggest follow-up questions if clarification is needed\n\nPrevious conversation context:\nAssistant: Wonderful! I'll help you plan a complete trip to Tokyo. This will include flights, hotels, and a suggested itinerary. Let me gather some information to create the perfect trip for you.\nUser: Ok, please do \nAssistant: I'd love to help you plan a complete trip! Where are you thinking of going, and when would you like to travel?\nUser: I wanna go to tokyo for a week on 8/25\n\n\nClassification examples:\nExample 1:\nInput: I need to book a flight from New York to Los Angeles next week\nOutput: {\""intent\"": \""flight_only\"", \""confidence\"": 0.95, \""entities\"": {\""origin\"": \""New York\"", \""destination\"": \""Los Angeles\"", \""time\"": \""next week\""}}\n\nExample 2:\nInput: Find me a hotel in San Francisco for 3 nights in December\nOutput: {\""intent\"": \""hotel_only\"", \""confidence\"": 0.92, \""entities\"": {\""location\"": \""San Francisco\"", \""duration\"": \""3 nights\"", \""time\"": \""December\""}}\n\nExample 3:\nInput: Plan a complete trip to Europe including flights and hotels\nOutput: {\""intent\"": \""full_trip\"", \""confidence\"": 0.98, \""entities\"": {\""destination\"": \""Europe\"", \""includes\"": [\""flights\"", \""hotels\""]}}\n\nExample 4:\nInput: What's the weather like in Tokyo in March?\nOutput: {\""intent\"": \""information\"", \""confidence\"": 0.89, \""entities\"": {\""location\"": \""Tokyo\"", \""topic\"": \""weather\"", \""time\"": \""March\""}}\n\nExample 5:\nInput: Hello, I'm looking for travel help\nOutput: {\""intent\"": \""greeting\"", \""confidence\"": 0.85, \""entities\"": {\""topic\"": \""travel\""}}\n\n\n\nRespond with valid JSON in this exact format:\n{\n    \""intent\"": \""intent_name\"",\n    \""confidence\"": 0.95,\n    \""entities\"": {\n        \""key\"": \""value\""\n    },\n    \""reasoning\"": \""Brief explanation of classification\"",\n    \""follow_up_questions\"": [\""question1\"", \""question2\""]\n}""}, {""role"": ""user"", ""content"": ""Classify this user message: I wanna go to tokyo for a week on 8/25""}], ""model"": ""gpt-4"", ""max_tokens"": 500, ""temperature"": 0.1}","{""id"":""chatcmpl-C3WN9lEvacC6cfDsd8RXpqLxKTcn6"",""choices"":[{""finish_reason"":""stop"",""index"":0,""logprobs"":null,""message"":{""content"":""{\n    \""intent\"": \""full_trip\"",\n    \""confidence\"": 0.95,\n    \""entities\"": {\n        \""destination\"": \""Tokyo\"",\n        \""duration\"": \""a week\"",\n        \""start_date\"": \""8/25\""\n    },\n    \""reasoning\"": \""The user has expressed a desire to go to Tokyo for a week starting on 8/25, which indicates they want a full trip planned.\"",\n    \""follow_up_questions\"": [\""What is your departure city?\"", \""Do you have any preferences for your accommodation?\"", \""Are there any specific activities or places you would like to include in your itinerary?\""]\n}"",""refusal"":null,""role"":""assistant"",""annotations"":[]}}],""created"":1754955459,""model"":""gpt-4-0613"",""object"":""chat.completion"",""service_tier"":""default"",""system_fingerprint"":null,""usage"":{""completion_tokens"":128,""prompt_tokens"":642,""total_tokens"":770,""completion_tokens_details"":{""accepted_prediction_tokens"":0,""audio_tokens"":0,""reasoning_tokens"":0,""rejected_prediction_tokens"":0},""prompt_tokens_details"":{""audio_tokens"":0,""cached_tokens"":0}}}",770,642,--,user-provided,128,--,user-provided,OK
ChatCompletion,LLM,OK,2025-08-11T23:37:12.057Z,,3397.225,ed79ef9061fb527b502df03ad3c1b82a,9d02cef594034383,,LLM,747,"{""messages"": [{""role"": ""system"", ""content"": ""You are an expert at classifying user intents for a travel planning assistant.\n\nAvailable intent categories:\n- flight_only: User wants flight search/booking only\n- hotel_only: User wants hotel search/booking only  \n- full_trip: User wants complete trip planning (flights + hotels + itinerary)\n- information: User wants general travel information (weather, events, etc.)\n- greeting: User is greeting or starting conversation\n- clarification_needed: Request is too vague and needs more information\n- unknown: Cannot determine intent\n\nYour task is to:\n1. Classify the user's intent\n2. Extract relevant entities (dates, locations, preferences, etc.)\n3. Provide confidence score (0.0-1.0)\n4. Give reasoning for your classification\n5. Suggest follow-up questions if clarification is needed\n\nPrevious conversation context:\nAssistant: I'd like to help you with your travel plans, but I need a bit more information. Do you need help with booking a flight? Are you looking for a hotel in Tokyo? Do you want a complete trip planned including flights and hotels? Are you looking for general information about Tokyo?\nUser: yes, I want a complete trip planned\nAssistant: Wonderful! I'll help you plan a complete trip to Tokyo. This will include flights, hotels, and a suggested itinerary. Let me gather some information to create the perfect trip for you.\nUser: Ok, please do \n\n\nClassification examples:\nExample 1:\nInput: I need to book a flight from New York to Los Angeles next week\nOutput: {\""intent\"": \""flight_only\"", \""confidence\"": 0.95, \""entities\"": {\""origin\"": \""New York\"", \""destination\"": \""Los Angeles\"", \""time\"": \""next week\""}}\n\nExample 2:\nInput: Find me a hotel in San Francisco for 3 nights in December\nOutput: {\""intent\"": \""hotel_only\"", \""confidence\"": 0.92, \""entities\"": {\""location\"": \""San Francisco\"", \""duration\"": \""3 nights\"", \""time\"": \""December\""}}\n\nExample 3:\nInput: Plan a complete trip to Europe including flights and hotels\nOutput: {\""intent\"": \""full_trip\"", \""confidence\"": 0.98, \""entities\"": {\""destination\"": \""Europe\"", \""includes\"": [\""flights\"", \""hotels\""]}}\n\nExample 4:\nInput: What's the weather like in Tokyo in March?\nOutput: {\""intent\"": \""information\"", \""confidence\"": 0.89, \""entities\"": {\""location\"": \""Tokyo\"", \""topic\"": \""weather\"", \""time\"": \""March\""}}\n\nExample 5:\nInput: Hello, I'm looking for travel help\nOutput: {\""intent\"": \""greeting\"", \""confidence\"": 0.85, \""entities\"": {\""topic\"": \""travel\""}}\n\n\n\nRespond with valid JSON in this exact format:\n{\n    \""intent\"": \""intent_name\"",\n    \""confidence\"": 0.95,\n    \""entities\"": {\n        \""key\"": \""value\""\n    },\n    \""reasoning\"": \""Brief explanation of classification\"",\n    \""follow_up_questions\"": [\""question1\"", \""question2\""]\n}""}, {""role"": ""user"", ""content"": ""Classify this user message: Ok, please do ""}], ""model"": ""gpt-4"", ""max_tokens"": 500, ""temperature"": 0.1}","{""id"":""chatcmpl-C3WMibA27b6jV2ggNOYYkYrxGLk3J"",""choices"":[{""finish_reason"":""stop"",""index"":0,""logprobs"":null,""message"":{""content"":""{\n    \""intent\"": \""full_trip\"",\n    \""confidence\"": 0.85,\n    \""entities\"": {},\n    \""reasoning\"": \""The user has previously expressed interest in planning a complete trip and is now giving the assistant permission to proceed with this task.\"",\n    \""follow_up_questions\"": [\""Where would you like to travel?\"", \""What are your preferred travel dates?\"", \""Do you have any specific preferences or requirements for your trip?\""]\n}"",""refusal"":null,""role"":""assistant"",""annotations"":[]}}],""created"":1754955432,""model"":""gpt-4-0613"",""object"":""chat.completion"",""service_tier"":""default"",""system_fingerprint"":null,""usage"":{""completion_tokens"":90,""prompt_tokens"":657,""total_tokens"":747,""completion_tokens_details"":{""accepted_prediction_tokens"":0,""audio_tokens"":0,""reasoning_tokens"":0,""rejected_prediction_tokens"":0},""prompt_tokens_details"":{""audio_tokens"":0,""cached_tokens"":0}}}",747,657,--,user-provided,90,--,user-provided,OK
ChatCompletion,LLM,OK,2025-08-11T23:36:16.314Z,,4403.085,dee38afcfb3fdbd3cee7d15ace5d1372,5fa59e959d59294b,,LLM,733,"{""messages"": [{""role"": ""system"", ""content"": ""You are an expert at classifying user intents for a travel planning assistant.\n\nAvailable intent categories:\n- flight_only: User wants flight search/booking only\n- hotel_only: User wants hotel search/booking only  \n- full_trip: User wants complete trip planning (flights + hotels + itinerary)\n- information: User wants general travel information (weather, events, etc.)\n- greeting: User is greeting or starting conversation\n- clarification_needed: Request is too vague and needs more information\n- unknown: Cannot determine intent\n\nYour task is to:\n1. Classify the user's intent\n2. Extract relevant entities (dates, locations, preferences, etc.)\n3. Provide confidence score (0.0-1.0)\n4. Give reasoning for your classification\n5. Suggest follow-up questions if clarification is needed\n\nPrevious conversation context:\nUser: I wanna go to Tokyo\nAssistant: I'd like to help you with your travel plans, but I need a bit more information. Do you need help with booking a flight? Are you looking for a hotel in Tokyo? Do you want a complete trip planned including flights and hotels? Are you looking for general information about Tokyo?\nUser: yes, I want a complete trip planned\n\n\nClassification examples:\nExample 1:\nInput: I need to book a flight from New York to Los Angeles next week\nOutput: {\""intent\"": \""flight_only\"", \""confidence\"": 0.95, \""entities\"": {\""origin\"": \""New York\"", \""destination\"": \""Los Angeles\"", \""time\"": \""next week\""}}\n\nExample 2:\nInput: Find me a hotel in San Francisco for 3 nights in December\nOutput: {\""intent\"": \""hotel_only\"", \""confidence\"": 0.92, \""entities\"": {\""location\"": \""San Francisco\"", \""duration\"": \""3 nights\"", \""time\"": \""December\""}}\n\nExample 3:\nInput: Plan a complete trip to Europe including flights and hotels\nOutput: {\""intent\"": \""full_trip\"", \""confidence\"": 0.98, \""entities\"": {\""destination\"": \""Europe\"", \""includes\"": [\""flights\"", \""hotels\""]}}\n\nExample 4:\nInput: What's the weather like in Tokyo in March?\nOutput: {\""intent\"": \""information\"", \""confidence\"": 0.89, \""entities\"": {\""location\"": \""Tokyo\"", \""topic\"": \""weather\"", \""time\"": \""March\""}}\n\nExample 5:\nInput: Hello, I'm looking for travel help\nOutput: {\""intent\"": \""greeting\"", \""confidence\"": 0.85, \""entities\"": {\""topic\"": \""travel\""}}\n\n\n\nRespond with valid JSON in this exact format:\n{\n    \""intent\"": \""intent_name\"",\n    \""confidence\"": 0.95,\n    \""entities\"": {\n        \""key\"": \""value\""\n    },\n    \""reasoning\"": \""Brief explanation of classification\"",\n    \""follow_up_questions\"": [\""question1\"", \""question2\""]\n}""}, {""role"": ""user"", ""content"": ""Classify this user message: yes, I want a complete trip planned""}], ""model"": ""gpt-4"", ""max_tokens"": 500, ""temperature"": 0.1}","{""id"":""chatcmpl-C3WLoe41BNxzNjam5ievV0ID2apgt"",""choices"":[{""finish_reason"":""stop"",""index"":0,""logprobs"":null,""message"":{""content"":""{\n    \""intent\"": \""full_trip\"",\n    \""confidence\"": 0.98,\n    \""entities\"": {\n        \""destination\"": \""Tokyo\""\n    },\n    \""reasoning\"": \""The user has explicitly stated that they want a complete trip planned, which includes flights, hotels, and itinerary. The destination mentioned in the previous conversation is Tokyo.\"",\n    \""follow_up_questions\"": [\""When do you plan to start your trip?\"", \""How long will you be staying in Tokyo?\"", \""Do you have any specific preferences or requirements for your trip?\""]\n}"",""refusal"":null,""role"":""assistant"",""annotations"":[]}}],""created"":1754955376,""model"":""gpt-4-0613"",""object"":""chat.completion"",""service_tier"":""default"",""system_fingerprint"":null,""usage"":{""completion_tokens"":112,""prompt_tokens"":621,""total_tokens"":733,""completion_tokens_details"":{""accepted_prediction_tokens"":0,""audio_tokens"":0,""reasoning_tokens"":0,""rejected_prediction_tokens"":0},""prompt_tokens_details"":{""audio_tokens"":0,""cached_tokens"":0}}}",733,621,--,user-provided,112,--,user-provided,OK
