name,spanKind,statusCode,start_time,parent_id,latency_ms,context.trace_id,context.span_id,attributes.session.id,attributes.openinference.span.kind,totalTokenCount,attributes.input.value,attributes.output.value,attributes.llm.token_count.total,attributes.llm.token_count.prompt,:arize-computed:tokenization.prompt.encoder,:arize-computed:tokenization.prompt.method,attributes.llm.token_count.completion,:arize-computed:tokenization.completion.encoder,:arize-computed:tokenization.completion.method,status_code
ChatCompletion,LLM,OK,2025-08-12T02:25:35.212Z,,2386.384,56d8f901c3b9b162d32e767481d32730,10dc588306e2f204,,LLM,213,"{""messages"": [{""content"": ""You are a flight booking expert providing clear, concise flight recommendations."", ""role"": ""system""}, {""content"": ""Travel Preferences: {\n  \""origin\"": \""San Francisco\"",\n  \""destination\"": \""fly from San Francisco to NYC\"",\n  \""departure_date\"": \""8/28/2025\"",\n  \""flight_search_params\"": {\n    \""origin\"": \""San Francisco\"",\n    \""destination\"": \""fly from San Francisco to NYC\"",\n    \""departure_date\"": \""8/28/2025\"",\n    \""passengers\"": 1,\n    \""cabin_class\"": \""economy\""\n  },\n  \""flight_search_completed\"": true\n}\n\nFlight Options:\nOption 1: Flight information\n\nPlease provide clear flight recommendations with key details like pricing, timing, and airlines."", ""role"": ""user""}], ""model"": ""gpt-4"", ""max_completion_tokens"": 2000, ""stream"": false, ""temperature"": 0.3}","{""id"":""chatcmpl-C3YzfpscmgMkfGwuLgfJqAc0jaLmo"",""choices"":[{""finish_reason"":""stop"",""index"":0,""logprobs"":null,""message"":{""content"":""I'm sorry, but I can't provide specific flight recommendations without the actual flight options. The flight options should include details such as flight numbers, airlines, departure and arrival times, and pricing. Once you provide these details, I'd be happy to help you choose the best option."",""refusal"":null,""role"":""assistant"",""annotations"":[]}}],""created"":1754965535,""model"":""gpt-4-0613"",""object"":""chat.completion"",""service_tier"":""default"",""system_fingerprint"":null,""usage"":{""completion_tokens"":57,""prompt_tokens"":156,""total_tokens"":213,""completion_tokens_details"":{""accepted_prediction_tokens"":0,""audio_tokens"":0,""reasoning_tokens"":0,""rejected_prediction_tokens"":0},""prompt_tokens_details"":{""audio_tokens"":0,""cached_tokens"":0}}}",213,156,--,user-provided,57,--,user-provided,OK
ChatCompletion,LLM,OK,2025-08-12T02:25:25.960Z,,9245.78,2ecdf5fbaf433073255832a56b2c121c,d26933a8bf348691,,LLM,875,"{""messages"": [{""content"": ""You are an expert travel planning assistant that classifies user intents and extracts travel preferences.\n\nAnalyze the user's message to determine their travel planning intent and extract relevant information.\n\nIntent Categories:\n- \""flight_only\"": User wants to search for flights only\n- \""hotel_only\"": User wants to search for hotels/accommodation only  \n- \""full_trip\"": User wants comprehensive trip planning (flights + hotels)\n- \""information\"": User wants general travel information (weather, events, advisories, etc.)\n\nRequired Information for Travel Planning:\n- Origin/departure location (for flights)\n- Destination location\n- Travel dates (departure/return dates)\n- Number of passengers/guests\n- Budget constraints (if mentioned)\n- Preferences (class, amenities, etc.)\n\nExtract any available travel preferences and identify missing critical information.\nReturn your analysis as JSON following the specified schema."", ""role"": ""system""}, {""content"": ""Current user message: I want to fly from San Francisco to NYC on 8/28\n\nPrevious conversation context (if any):\nUser: I want to fly from San Francisco to NYC on 8/28\n\nAnalyze this input and provide your classification as JSON.\n\nThe output should be formatted as a JSON instance that conforms to the JSON schema below.\n\nAs an example, for the schema {\""properties\"": {\""foo\"": {\""title\"": \""Foo\"", \""description\"": \""a list of strings\"", \""type\"": \""array\"", \""items\"": {\""type\"": \""string\""}}}, \""required\"": [\""foo\""]}\nthe object {\""foo\"": [\""bar\"", \""baz\""]} is a well-formatted instance of the schema. The object {\""properties\"": {\""foo\"": [\""bar\"", \""baz\""]}} is not well-formatted.\n\nHere is the output schema:\n```\n{\""description\"": \""Structured output for intent classification.\"", \""properties\"": {\""intent\"": {\""description\"": \""Classified intent: flight_only, hotel_only, full_trip, or information\"", \""title\"": \""Intent\"", \""type\"": \""string\""}, \""confidence\"": {\""description\"": \""Confidence score from 0.0 to 1.0\"", \""title\"": \""Confidence\"", \""type\"": \""number\""}, \""clarification_needed\"": {\""description\"": \""Whether additional information is needed\"", \""title\"": \""Clarification Needed\"", \""type\"": \""boolean\""}, \""travel_preferences\"": {\""additionalProperties\"": true, \""description\"": \""Extracted travel preferences\"", \""title\"": \""Travel Preferences\"", \""type\"": \""object\""}, \""missing_information\"": {\""description\"": \""List of missing required information\"", \""items\"": {\""type\"": \""string\""}, \""title\"": \""Missing Information\"", \""type\"": \""array\""}}, \""required\"": [\""intent\"", \""confidence\"", \""clarification_needed\"", \""travel_preferences\"", \""missing_information\""]}\n```"", ""role"": ""user""}], ""model"": ""gpt-4"", ""max_completion_tokens"": 1000, ""stream"": false, ""temperature"": 0.1}","{""id"":""chatcmpl-C3YzWlM3eFJhetWmYsr75SsKEDfjj"",""choices"":[{""finish_reason"":""stop"",""index"":0,""logprobs"":null,""message"":{""content"":""{\n\""description\"": \""Structured output for intent classification.\"",\n\""properties\"": {\n    \""intent\"": {\n        \""description\"": \""Classified intent: flight_only, hotel_only, full_trip, or information\"",\n        \""title\"": \""Intent\"",\n        \""type\"": \""string\"",\n        \""value\"": \""flight_only\""\n    },\n    \""confidence\"": {\n        \""description\"": \""Confidence score from 0.0 to 1.0\"",\n        \""title\"": \""Confidence\"",\n        \""type\"": \""number\"",\n        \""value\"": 0.95\n    },\n    \""clarification_needed\"": {\n        \""description\"": \""Whether additional information is needed\"",\n        \""title\"": \""Clarification Needed\"",\n        \""type\"": \""boolean\"",\n        \""value\"": true\n    },\n    \""travel_preferences\"": {\n        \""additionalProperties\"": true,\n        \""description\"": \""Extracted travel preferences\"",\n        \""title\"": \""Travel Preferences\"",\n        \""type\"": \""object\"",\n        \""value\"": {\n            \""origin\"": \""San Francisco\"",\n            \""destination\"": \""NYC\"",\n            \""departure_date\"": \""8/28\""\n        }\n    },\n    \""missing_information\"": {\n        \""description\"": \""List of missing required information\"",\n        \""items\"": {\n            \""type\"": \""string\""\n        },\n        \""title\"": \""Missing Information\"",\n        \""type\"": \""array\"",\n        \""value\"": [\""return_date\"", \""number_of_passengers\""]\n    }\n},\n\""required\"": [\""intent\"", \""confidence\"", \""clarification_needed\"", \""travel_preferences\"", \""missing_information\""]\n}"",""refusal"":null,""role"":""assistant"",""annotations"":[]}}],""created"":1754965526,""model"":""gpt-4-0613"",""object"":""chat.completion"",""service_tier"":""default"",""system_fingerprint"":null,""usage"":{""completion_tokens"":315,""prompt_tokens"":560,""total_tokens"":875,""completion_tokens_details"":{""accepted_prediction_tokens"":0,""audio_tokens"":0,""reasoning_tokens"":0,""rejected_prediction_tokens"":0},""prompt_tokens_details"":{""audio_tokens"":0,""cached_tokens"":0}}}",875,560,--,user-provided,315,--,user-provided,OK
ChatCompletion,LLM,OK,2025-08-12T00:19:59.461Z,,3258.698,643d9095373fa960a19a21dd4b2f524f,9a91ecc449e02d71,,LLM,706,"{""messages"": [{""role"": ""system"", ""content"": ""You are an expert at classifying user intents for a travel planning assistant.\n\nAvailable intent categories:\n- flight_only: User wants flight search/booking only\n- hotel_only: User wants hotel search/booking only  \n- full_trip: User wants complete trip planning (flights + hotels + itinerary)\n- information: User wants general travel information (weather, events, etc.)\n- greeting: User is greeting or starting conversation\n- clarification_needed: Request is too vague and needs more information\n- unknown: Cannot determine intent\n\nYour task is to:\n1. Classify the user's intent\n2. Extract relevant entities (dates, locations, preferences, etc.)\n3. Provide confidence score (0.0-1.0)\n4. Give reasoning for your classification\n5. Suggest follow-up questions if clarification is needed\n\nPrevious conversation context:\nUser: I want to fly from San Francisco to NYC on 8/28\nAssistant: I'd be happy to help you find flights! I just need a bit more information: travel dates. Could you provide these details?\nUser: 8/28 to 8/31\n\n\nClassification examples:\nExample 1:\nInput: I need to book a flight from New York to Los Angeles next week\nOutput: {\""intent\"": \""flight_only\"", \""confidence\"": 0.95, \""entities\"": {\""origin\"": \""New York\"", \""destination\"": \""Los Angeles\"", \""time\"": \""next week\""}}\n\nExample 2:\nInput: Find me a hotel in San Francisco for 3 nights in December\nOutput: {\""intent\"": \""hotel_only\"", \""confidence\"": 0.92, \""entities\"": {\""location\"": \""San Francisco\"", \""duration\"": \""3 nights\"", \""time\"": \""December\""}}\n\nExample 3:\nInput: Plan a complete trip to Europe including flights and hotels\nOutput: {\""intent\"": \""full_trip\"", \""confidence\"": 0.98, \""entities\"": {\""destination\"": \""Europe\"", \""includes\"": [\""flights\"", \""hotels\""]}}\n\nExample 4:\nInput: What's the weather like in Tokyo in March?\nOutput: {\""intent\"": \""information\"", \""confidence\"": 0.89, \""entities\"": {\""location\"": \""Tokyo\"", \""topic\"": \""weather\"", \""time\"": \""March\""}}\n\nExample 5:\nInput: Hello, I'm looking for travel help\nOutput: {\""intent\"": \""greeting\"", \""confidence\"": 0.85, \""entities\"": {\""topic\"": \""travel\""}}\n\n\n\nRespond with valid JSON in this exact format:\n{\n    \""intent\"": \""intent_name\"",\n    \""confidence\"": 0.95,\n    \""entities\"": {\n        \""key\"": \""value\""\n    },\n    \""reasoning\"": \""Brief explanation of classification\"",\n    \""follow_up_questions\"": [\""question1\"", \""question2\""]\n}""}, {""role"": ""user"", ""content"": ""Classify this user message: 8/28 to 8/31""}], ""model"": ""gpt-4"", ""max_tokens"": 500, ""temperature"": 0.1}","{""id"":""chatcmpl-C3X27DsyG6sfcetEp1vQNq2N5B6mH"",""choices"":[{""finish_reason"":""stop"",""index"":0,""logprobs"":null,""message"":{""content"":""{\n    \""intent\"": \""flight_only\"",\n    \""confidence\"": 0.95,\n    \""entities\"": {\n        \""departure_date\"": \""8/28\"",\n        \""return_date\"": \""8/31\""\n    },\n    \""reasoning\"": \""The user has provided specific dates for a flight, which follows up on their previous request to find flights from San Francisco to NYC.\"",\n    \""follow_up_questions\"": [\""Do you have a preferred time of day to fly?\"", \""Do you have a preferred airline?\""]\n}"",""refusal"":null,""role"":""assistant"",""annotations"":[]}}],""created"":1754957999,""model"":""gpt-4-0613"",""object"":""chat.completion"",""service_tier"":""default"",""system_fingerprint"":null,""usage"":{""completion_tokens"":105,""prompt_tokens"":601,""total_tokens"":706,""completion_tokens_details"":{""accepted_prediction_tokens"":0,""audio_tokens"":0,""reasoning_tokens"":0,""rejected_prediction_tokens"":0},""prompt_tokens_details"":{""audio_tokens"":0,""cached_tokens"":0}}}",706,601,--,user-provided,105,--,user-provided,OK
ChatCompletion,LLM,OK,2025-08-12T00:19:31.961Z,,3840.503,21b297ec85ad6bc36fac0a4a2249266d,a566daee37f9b2c0,,LLM,676,"{""messages"": [{""role"": ""system"", ""content"": ""You are an expert at classifying user intents for a travel planning assistant.\n\nAvailable intent categories:\n- flight_only: User wants flight search/booking only\n- hotel_only: User wants hotel search/booking only  \n- full_trip: User wants complete trip planning (flights + hotels + itinerary)\n- information: User wants general travel information (weather, events, etc.)\n- greeting: User is greeting or starting conversation\n- clarification_needed: Request is too vague and needs more information\n- unknown: Cannot determine intent\n\nYour task is to:\n1. Classify the user's intent\n2. Extract relevant entities (dates, locations, preferences, etc.)\n3. Provide confidence score (0.0-1.0)\n4. Give reasoning for your classification\n5. Suggest follow-up questions if clarification is needed\n\nPrevious conversation context:\nUser: I want to fly from San Francisco to NYC on 8/28\n\n\nClassification examples:\nExample 1:\nInput: I need to book a flight from New York to Los Angeles next week\nOutput: {\""intent\"": \""flight_only\"", \""confidence\"": 0.95, \""entities\"": {\""origin\"": \""New York\"", \""destination\"": \""Los Angeles\"", \""time\"": \""next week\""}}\n\nExample 2:\nInput: Find me a hotel in San Francisco for 3 nights in December\nOutput: {\""intent\"": \""hotel_only\"", \""confidence\"": 0.92, \""entities\"": {\""location\"": \""San Francisco\"", \""duration\"": \""3 nights\"", \""time\"": \""December\""}}\n\nExample 3:\nInput: Plan a complete trip to Europe including flights and hotels\nOutput: {\""intent\"": \""full_trip\"", \""confidence\"": 0.98, \""entities\"": {\""destination\"": \""Europe\"", \""includes\"": [\""flights\"", \""hotels\""]}}\n\nExample 4:\nInput: What's the weather like in Tokyo in March?\nOutput: {\""intent\"": \""information\"", \""confidence\"": 0.89, \""entities\"": {\""location\"": \""Tokyo\"", \""topic\"": \""weather\"", \""time\"": \""March\""}}\n\nExample 5:\nInput: Hello, I'm looking for travel help\nOutput: {\""intent\"": \""greeting\"", \""confidence\"": 0.85, \""entities\"": {\""topic\"": \""travel\""}}\n\n\n\nRespond with valid JSON in this exact format:\n{\n    \""intent\"": \""intent_name\"",\n    \""confidence\"": 0.95,\n    \""entities\"": {\n        \""key\"": \""value\""\n    },\n    \""reasoning\"": \""Brief explanation of classification\"",\n    \""follow_up_questions\"": [\""question1\"", \""question2\""]\n}""}, {""role"": ""user"", ""content"": ""Classify this user message: I want to fly from San Francisco to NYC on 8/28""}], ""model"": ""gpt-4"", ""max_tokens"": 500, ""temperature"": 0.1}","{""id"":""chatcmpl-C3X1giY2KmGggEkWjzDDLAfMmOwc5"",""choices"":[{""finish_reason"":""stop"",""index"":0,""logprobs"":null,""message"":{""content"":""{\n    \""intent\"": \""flight_only\"",\n    \""confidence\"": 0.98,\n    \""entities\"": {\n        \""origin\"": \""San Francisco\"",\n        \""destination\"": \""NYC\"",\n        \""date\"": \""8/28\""\n    },\n    \""reasoning\"": \""The user explicitly mentioned wanting to fly from one location to another on a specific date, which indicates a flight booking intent.\"",\n    \""follow_up_questions\"": [\""What time would you prefer your flight?\"", \""Are you looking for a one-way ticket or a round trip?\""]\n}"",""refusal"":null,""role"":""assistant"",""annotations"":[]}}],""created"":1754957972,""model"":""gpt-4-0613"",""object"":""chat.completion"",""service_tier"":""default"",""system_fingerprint"":null,""usage"":{""completion_tokens"":111,""prompt_tokens"":565,""total_tokens"":676,""completion_tokens_details"":{""accepted_prediction_tokens"":0,""audio_tokens"":0,""reasoning_tokens"":0,""rejected_prediction_tokens"":0},""prompt_tokens_details"":{""audio_tokens"":0,""cached_tokens"":0}}}",676,565,--,user-provided,111,--,user-provided,OK
ChatCompletion,LLM,OK,2025-08-12T00:08:55.472Z,,4219.473,bf985bee144b8bdb4607c588449f4061,92b4784d0c9504c0,,LLM,728,"{""messages"": [{""role"": ""system"", ""content"": ""You are an expert at classifying user intents for a travel planning assistant.\n\nAvailable intent categories:\n- flight_only: User wants flight search/booking only\n- hotel_only: User wants hotel search/booking only  \n- full_trip: User wants complete trip planning (flights + hotels + itinerary)\n- information: User wants general travel information (weather, events, etc.)\n- greeting: User is greeting or starting conversation\n- clarification_needed: Request is too vague and needs more information\n- unknown: Cannot determine intent\n\nYour task is to:\n1. Classify the user's intent\n2. Extract relevant entities (dates, locations, preferences, etc.)\n3. Provide confidence score (0.0-1.0)\n4. Give reasoning for your classification\n5. Suggest follow-up questions if clarification is needed\n\nPrevious conversation context:\nAssistant: I'd be happy to help you find hotels! I just need some more details: dates. Could you provide this information?\nUser: December 1 to December 15\nAssistant: I'd be happy to help you find hotels! I just need some more details: location, dates. Could you provide this information?\nUser: Find me a hotel in San Francisco from Dec 15-18\n\n\nClassification examples:\nExample 1:\nInput: I need to book a flight from New York to Los Angeles next week\nOutput: {\""intent\"": \""flight_only\"", \""confidence\"": 0.95, \""entities\"": {\""origin\"": \""New York\"", \""destination\"": \""Los Angeles\"", \""time\"": \""next week\""}}\n\nExample 2:\nInput: Find me a hotel in San Francisco for 3 nights in December\nOutput: {\""intent\"": \""hotel_only\"", \""confidence\"": 0.92, \""entities\"": {\""location\"": \""San Francisco\"", \""duration\"": \""3 nights\"", \""time\"": \""December\""}}\n\nExample 3:\nInput: Plan a complete trip to Europe including flights and hotels\nOutput: {\""intent\"": \""full_trip\"", \""confidence\"": 0.98, \""entities\"": {\""destination\"": \""Europe\"", \""includes\"": [\""flights\"", \""hotels\""]}}\n\nExample 4:\nInput: What's the weather like in Tokyo in March?\nOutput: {\""intent\"": \""information\"", \""confidence\"": 0.89, \""entities\"": {\""location\"": \""Tokyo\"", \""topic\"": \""weather\"", \""time\"": \""March\""}}\n\nExample 5:\nInput: Hello, I'm looking for travel help\nOutput: {\""intent\"": \""greeting\"", \""confidence\"": 0.85, \""entities\"": {\""topic\"": \""travel\""}}\n\n\n\nRespond with valid JSON in this exact format:\n{\n    \""intent\"": \""intent_name\"",\n    \""confidence\"": 0.95,\n    \""entities\"": {\n        \""key\"": \""value\""\n    },\n    \""reasoning\"": \""Brief explanation of classification\"",\n    \""follow_up_questions\"": [\""question1\"", \""question2\""]\n}""}, {""role"": ""user"", ""content"": ""Classify this user message: Find me a hotel in San Francisco from Dec 15-18""}], ""model"": ""gpt-4"", ""max_tokens"": 500, ""temperature"": 0.1}","{""id"":""chatcmpl-C3WrPmEz6avQOBDt5MmabNPURkQ14"",""choices"":[{""finish_reason"":""stop"",""index"":0,""logprobs"":null,""message"":{""content"":""{\n    \""intent\"": \""hotel_only\"",\n    \""confidence\"": 0.98,\n    \""entities\"": {\n        \""location\"": \""San Francisco\"",\n        \""time\"": \""Dec 15-18\""\n    },\n    \""reasoning\"": \""The user is specifically asking for a hotel in a specific location and time, indicating a hotel-only intent.\"",\n    \""follow_up_questions\"": [\""What is your budget for the hotel?\"", \""Do you have any specific preferences for the hotel?\""]\n}"",""refusal"":null,""role"":""assistant"",""annotations"":[]}}],""created"":1754957335,""model"":""gpt-4-0613"",""object"":""chat.completion"",""service_tier"":""default"",""system_fingerprint"":null,""usage"":{""completion_tokens"":99,""prompt_tokens"":629,""total_tokens"":728,""completion_tokens_details"":{""accepted_prediction_tokens"":0,""audio_tokens"":0,""reasoning_tokens"":0,""rejected_prediction_tokens"":0},""prompt_tokens_details"":{""audio_tokens"":0,""cached_tokens"":0}}}",728,629,--,user-provided,99,--,user-provided,OK
ChatCompletion,LLM,OK,2025-08-12T00:08:40.681Z,,3154.135,f10bdc04319bdcadaf0354cc4dfc4507,6baf938dadb738b9,,LLM,725,"{""messages"": [{""role"": ""system"", ""content"": ""You are an expert at classifying user intents for a travel planning assistant.\n\nAvailable intent categories:\n- flight_only: User wants flight search/booking only\n- hotel_only: User wants hotel search/booking only  \n- full_trip: User wants complete trip planning (flights + hotels + itinerary)\n- information: User wants general travel information (weather, events, etc.)\n- greeting: User is greeting or starting conversation\n- clarification_needed: Request is too vague and needs more information\n- unknown: Cannot determine intent\n\nYour task is to:\n1. Classify the user's intent\n2. Extract relevant entities (dates, locations, preferences, etc.)\n3. Provide confidence score (0.0-1.0)\n4. Give reasoning for your classification\n5. Suggest follow-up questions if clarification is needed\n\nPrevious conversation context:\nAssistant: I'd like to help you with your travel plans, but I need a bit more information. Did you mean to say from December 1 to December 15? Can you please confirm the dates for your stay in San Francisco?\nUser: Correct\nAssistant: I'd be happy to help you find hotels! I just need some more details: dates. Could you provide this information?\nUser: December 1 to December 15\n\n\nClassification examples:\nExample 1:\nInput: I need to book a flight from New York to Los Angeles next week\nOutput: {\""intent\"": \""flight_only\"", \""confidence\"": 0.95, \""entities\"": {\""origin\"": \""New York\"", \""destination\"": \""Los Angeles\"", \""time\"": \""next week\""}}\n\nExample 2:\nInput: Find me a hotel in San Francisco for 3 nights in December\nOutput: {\""intent\"": \""hotel_only\"", \""confidence\"": 0.92, \""entities\"": {\""location\"": \""San Francisco\"", \""duration\"": \""3 nights\"", \""time\"": \""December\""}}\n\nExample 3:\nInput: Plan a complete trip to Europe including flights and hotels\nOutput: {\""intent\"": \""full_trip\"", \""confidence\"": 0.98, \""entities\"": {\""destination\"": \""Europe\"", \""includes\"": [\""flights\"", \""hotels\""]}}\n\nExample 4:\nInput: What's the weather like in Tokyo in March?\nOutput: {\""intent\"": \""information\"", \""confidence\"": 0.89, \""entities\"": {\""location\"": \""Tokyo\"", \""topic\"": \""weather\"", \""time\"": \""March\""}}\n\nExample 5:\nInput: Hello, I'm looking for travel help\nOutput: {\""intent\"": \""greeting\"", \""confidence\"": 0.85, \""entities\"": {\""topic\"": \""travel\""}}\n\n\n\nRespond with valid JSON in this exact format:\n{\n    \""intent\"": \""intent_name\"",\n    \""confidence\"": 0.95,\n    \""entities\"": {\n        \""key\"": \""value\""\n    },\n    \""reasoning\"": \""Brief explanation of classification\"",\n    \""follow_up_questions\"": [\""question1\"", \""question2\""]\n}""}, {""role"": ""user"", ""content"": ""Classify this user message: December 1 to December 15""}], ""model"": ""gpt-4"", ""max_tokens"": 500, ""temperature"": 0.1}","{""id"":""chatcmpl-C3WrBs0dPZ25YdbGEYDqCeJcaWxql"",""choices"":[{""finish_reason"":""stop"",""index"":0,""logprobs"":null,""message"":{""content"":""{\n    \""intent\"": \""hotel_only\"",\n    \""confidence\"": 0.95,\n    \""entities\"": {\n        \""dates\"": \""December 1 to December 15\""\n    },\n    \""reasoning\"": \""The user is providing the dates for their hotel stay, which was requested by the assistant in the previous message.\"",\n    \""follow_up_questions\"": [\""What type of hotel are you looking for?\"", \""Do you have a preferred location in San Francisco?\""]\n}"",""refusal"":null,""role"":""assistant"",""annotations"":[]}}],""created"":1754957321,""model"":""gpt-4-0613"",""object"":""chat.completion"",""service_tier"":""default"",""system_fingerprint"":null,""usage"":{""completion_tokens"":95,""prompt_tokens"":630,""total_tokens"":725,""completion_tokens_details"":{""accepted_prediction_tokens"":0,""audio_tokens"":0,""reasoning_tokens"":0,""rejected_prediction_tokens"":0},""prompt_tokens_details"":{""audio_tokens"":0,""cached_tokens"":0}}}",725,630,--,user-provided,95,--,user-provided,OK
