name,spanKind,statusCode,start_time,parent_id,latency_ms,context.trace_id,context.span_id,attributes.session.id,attributes.openinference.span.kind,totalTokenCount,attributes.input.value,attributes.output.value,attributes.llm.token_count.total,attributes.llm.token_count.prompt,:arize-computed:tokenization.prompt.encoder,:arize-computed:tokenization.prompt.method,attributes.llm.token_count.completion,:arize-computed:tokenization.completion.encoder,:arize-computed:tokenization.completion.method,status_code
ChatCompletion,LLM,OK,2025-08-12T00:08:26.041Z,,3466.43,a64f7c5e0d61ebbda7631750a50ffd09,e68d616093a6edcd,,LLM,755,"{""messages"": [{""role"": ""system"", ""content"": ""You are an expert at classifying user intents for a travel planning assistant.\n\nAvailable intent categories:\n- flight_only: User wants flight search/booking only\n- hotel_only: User wants hotel search/booking only  \n- full_trip: User wants complete trip planning (flights + hotels + itinerary)\n- information: User wants general travel information (weather, events, etc.)\n- greeting: User is greeting or starting conversation\n- clarification_needed: Request is too vague and needs more information\n- unknown: Cannot determine intent\n\nYour task is to:\n1. Classify the user's intent\n2. Extract relevant entities (dates, locations, preferences, etc.)\n3. Provide confidence score (0.0-1.0)\n4. Give reasoning for your classification\n5. Suggest follow-up questions if clarification is needed\n\nPrevious conversation context:\nAssistant: Welcome! I'm your AI travel companion. I can help you search for flights, find hotels, plan itineraries, or provide travel information. What are you planning?\nUser: Find me a hotel in San Francisco from          │\n│   December 15 to December 1\nAssistant: I'd like to help you with your travel plans, but I need a bit more information. Did you mean to say from December 1 to December 15? Can you please confirm the dates for your stay in San Francisco?\nUser: Correct\n\n\nClassification examples:\nExample 1:\nInput: I need to book a flight from New York to Los Angeles next week\nOutput: {\""intent\"": \""flight_only\"", \""confidence\"": 0.95, \""entities\"": {\""origin\"": \""New York\"", \""destination\"": \""Los Angeles\"", \""time\"": \""next week\""}}\n\nExample 2:\nInput: Find me a hotel in San Francisco for 3 nights in December\nOutput: {\""intent\"": \""hotel_only\"", \""confidence\"": 0.92, \""entities\"": {\""location\"": \""San Francisco\"", \""duration\"": \""3 nights\"", \""time\"": \""December\""}}\n\nExample 3:\nInput: Plan a complete trip to Europe including flights and hotels\nOutput: {\""intent\"": \""full_trip\"", \""confidence\"": 0.98, \""entities\"": {\""destination\"": \""Europe\"", \""includes\"": [\""flights\"", \""hotels\""]}}\n\nExample 4:\nInput: What's the weather like in Tokyo in March?\nOutput: {\""intent\"": \""information\"", \""confidence\"": 0.89, \""entities\"": {\""location\"": \""Tokyo\"", \""topic\"": \""weather\"", \""time\"": \""March\""}}\n\nExample 5:\nInput: Hello, I'm looking for travel help\nOutput: {\""intent\"": \""greeting\"", \""confidence\"": 0.85, \""entities\"": {\""topic\"": \""travel\""}}\n\n\n\nRespond with valid JSON in this exact format:\n{\n    \""intent\"": \""intent_name\"",\n    \""confidence\"": 0.95,\n    \""entities\"": {\n        \""key\"": \""value\""\n    },\n    \""reasoning\"": \""Brief explanation of classification\"",\n    \""follow_up_questions\"": [\""question1\"", \""question2\""]\n}""}, {""role"": ""user"", ""content"": ""Classify this user message: Correct""}], ""model"": ""gpt-4"", ""max_tokens"": 500, ""temperature"": 0.1}","{""id"":""chatcmpl-C3WqwWULTxSlTXnDsD8m7uvYEesSq"",""choices"":[{""finish_reason"":""stop"",""index"":0,""logprobs"":null,""message"":{""content"":""{\n    \""intent\"": \""hotel_only\"",\n    \""confidence\"": 0.95,\n    \""entities\"": {\n        \""location\"": \""San Francisco\"",\n        \""start_date\"": \""December 1\"",\n        \""end_date\"": \""December 15\""\n    },\n    \""reasoning\"": \""The user confirmed the corrected dates for their hotel stay in San Francisco, which was previously mentioned.\"",\n    \""follow_up_questions\"": [\""What type of hotel are you looking for?\"", \""Do you have a budget in mind for your stay?\""]\n}"",""refusal"":null,""role"":""assistant"",""annotations"":[]}}],""created"":1754957306,""model"":""gpt-4-0613"",""object"":""chat.completion"",""service_tier"":""default"",""system_fingerprint"":null,""usage"":{""completion_tokens"":108,""prompt_tokens"":647,""total_tokens"":755,""completion_tokens_details"":{""accepted_prediction_tokens"":0,""audio_tokens"":0,""reasoning_tokens"":0,""rejected_prediction_tokens"":0},""prompt_tokens_details"":{""audio_tokens"":0,""cached_tokens"":0}}}",755,647,--,user-provided,108,--,user-provided,OK
ChatCompletion,LLM,OK,2025-08-12T00:08:14.624Z,,3844.671,e95234ec202b0d9927636696df681994,415d4278f231032b,,LLM,731,"{""messages"": [{""role"": ""system"", ""content"": ""You are an expert at classifying user intents for a travel planning assistant.\n\nAvailable intent categories:\n- flight_only: User wants flight search/booking only\n- hotel_only: User wants hotel search/booking only  \n- full_trip: User wants complete trip planning (flights + hotels + itinerary)\n- information: User wants general travel information (weather, events, etc.)\n- greeting: User is greeting or starting conversation\n- clarification_needed: Request is too vague and needs more information\n- unknown: Cannot determine intent\n\nYour task is to:\n1. Classify the user's intent\n2. Extract relevant entities (dates, locations, preferences, etc.)\n3. Provide confidence score (0.0-1.0)\n4. Give reasoning for your classification\n5. Suggest follow-up questions if clarification is needed\n\nPrevious conversation context:\nUser: Hello\nAssistant: Welcome! I'm your AI travel companion. I can help you search for flights, find hotels, plan itineraries, or provide travel information. What are you planning?\nUser: Find me a hotel in San Francisco from          │\n│   December 15 to December 1\n\n\nClassification examples:\nExample 1:\nInput: I need to book a flight from New York to Los Angeles next week\nOutput: {\""intent\"": \""flight_only\"", \""confidence\"": 0.95, \""entities\"": {\""origin\"": \""New York\"", \""destination\"": \""Los Angeles\"", \""time\"": \""next week\""}}\n\nExample 2:\nInput: Find me a hotel in San Francisco for 3 nights in December\nOutput: {\""intent\"": \""hotel_only\"", \""confidence\"": 0.92, \""entities\"": {\""location\"": \""San Francisco\"", \""duration\"": \""3 nights\"", \""time\"": \""December\""}}\n\nExample 3:\nInput: Plan a complete trip to Europe including flights and hotels\nOutput: {\""intent\"": \""full_trip\"", \""confidence\"": 0.98, \""entities\"": {\""destination\"": \""Europe\"", \""includes\"": [\""flights\"", \""hotels\""]}}\n\nExample 4:\nInput: What's the weather like in Tokyo in March?\nOutput: {\""intent\"": \""information\"", \""confidence\"": 0.89, \""entities\"": {\""location\"": \""Tokyo\"", \""topic\"": \""weather\"", \""time\"": \""March\""}}\n\nExample 5:\nInput: Hello, I'm looking for travel help\nOutput: {\""intent\"": \""greeting\"", \""confidence\"": 0.85, \""entities\"": {\""topic\"": \""travel\""}}\n\n\n\nRespond with valid JSON in this exact format:\n{\n    \""intent\"": \""intent_name\"",\n    \""confidence\"": 0.95,\n    \""entities\"": {\n        \""key\"": \""value\""\n    },\n    \""reasoning\"": \""Brief explanation of classification\"",\n    \""follow_up_questions\"": [\""question1\"", \""question2\""]\n}""}, {""role"": ""user"", ""content"": ""Classify this user message: Find me a hotel in San Francisco from          │\n│   December 15 to December 1""}], ""model"": ""gpt-4"", ""max_tokens"": 500, ""temperature"": 0.1}","{""id"":""chatcmpl-C3Wqk4lknGr7a4AsByHVq4dwWmlOK"",""choices"":[{""finish_reason"":""stop"",""index"":0,""logprobs"":null,""message"":{""content"":""{\n    \""intent\"": \""clarification_needed\"",\n    \""confidence\"": 0.85,\n    \""entities\"": {\n        \""location\"": \""San Francisco\"",\n        \""start_date\"": \""December 15\"",\n        \""end_date\"": \""December 1\""\n    },\n    \""reasoning\"": \""The user's request is unclear because the end date is before the start date.\"",\n    \""follow_up_questions\"": [\""Did you mean to say from December 1 to December 15?\"", \""Can you please confirm the dates for your stay in San Francisco?\""]\n}"",""refusal"":null,""role"":""assistant"",""annotations"":[]}}],""created"":1754957294,""model"":""gpt-4-0613"",""object"":""chat.completion"",""service_tier"":""default"",""system_fingerprint"":null,""usage"":{""completion_tokens"":113,""prompt_tokens"":618,""total_tokens"":731,""completion_tokens_details"":{""accepted_prediction_tokens"":0,""audio_tokens"":0,""reasoning_tokens"":0,""rejected_prediction_tokens"":0},""prompt_tokens_details"":{""audio_tokens"":0,""cached_tokens"":0}}}",731,618,--,user-provided,113,--,user-provided,OK
ChatCompletion,LLM,OK,2025-08-12T00:06:30.392Z,,2533.755,edb8721294168259398c3228417500ae,abee1dc1bba57545,,LLM,602,"{""messages"": [{""role"": ""system"", ""content"": ""You are an expert at classifying user intents for a travel planning assistant.\n\nAvailable intent categories:\n- flight_only: User wants flight search/booking only\n- hotel_only: User wants hotel search/booking only  \n- full_trip: User wants complete trip planning (flights + hotels + itinerary)\n- information: User wants general travel information (weather, events, etc.)\n- greeting: User is greeting or starting conversation\n- clarification_needed: Request is too vague and needs more information\n- unknown: Cannot determine intent\n\nYour task is to:\n1. Classify the user's intent\n2. Extract relevant entities (dates, locations, preferences, etc.)\n3. Provide confidence score (0.0-1.0)\n4. Give reasoning for your classification\n5. Suggest follow-up questions if clarification is needed\n\nPrevious conversation context:\nUser: Hello\n\n\nClassification examples:\nExample 1:\nInput: I need to book a flight from New York to Los Angeles next week\nOutput: {\""intent\"": \""flight_only\"", \""confidence\"": 0.95, \""entities\"": {\""origin\"": \""New York\"", \""destination\"": \""Los Angeles\"", \""time\"": \""next week\""}}\n\nExample 2:\nInput: Find me a hotel in San Francisco for 3 nights in December\nOutput: {\""intent\"": \""hotel_only\"", \""confidence\"": 0.92, \""entities\"": {\""location\"": \""San Francisco\"", \""duration\"": \""3 nights\"", \""time\"": \""December\""}}\n\nExample 3:\nInput: Plan a complete trip to Europe including flights and hotels\nOutput: {\""intent\"": \""full_trip\"", \""confidence\"": 0.98, \""entities\"": {\""destination\"": \""Europe\"", \""includes\"": [\""flights\"", \""hotels\""]}}\n\nExample 4:\nInput: What's the weather like in Tokyo in March?\nOutput: {\""intent\"": \""information\"", \""confidence\"": 0.89, \""entities\"": {\""location\"": \""Tokyo\"", \""topic\"": \""weather\"", \""time\"": \""March\""}}\n\nExample 5:\nInput: Hello, I'm looking for travel help\nOutput: {\""intent\"": \""greeting\"", \""confidence\"": 0.85, \""entities\"": {\""topic\"": \""travel\""}}\n\n\n\nRespond with valid JSON in this exact format:\n{\n    \""intent\"": \""intent_name\"",\n    \""confidence\"": 0.95,\n    \""entities\"": {\n        \""key\"": \""value\""\n    },\n    \""reasoning\"": \""Brief explanation of classification\"",\n    \""follow_up_questions\"": [\""question1\"", \""question2\""]\n}""}, {""role"": ""user"", ""content"": ""Classify this user message: Hello""}], ""model"": ""gpt-4"", ""max_tokens"": 500, ""temperature"": 0.1}","{""id"":""chatcmpl-C3Wp5HRe0JywZ1gn5Lcg8jQDR8RkY"",""choices"":[{""finish_reason"":""stop"",""index"":0,""logprobs"":null,""message"":{""content"":""{\n    \""intent\"": \""greeting\"",\n    \""confidence\"": 1.0,\n    \""entities\"": {},\n    \""reasoning\"": \""The user is simply greeting the assistant, no specific intent is expressed.\"",\n    \""follow_up_questions\"": [\""How can I assist you with your travel plans today?\""]\n}"",""refusal"":null,""role"":""assistant"",""annotations"":[]}}],""created"":1754957191,""model"":""gpt-4-0613"",""object"":""chat.completion"",""service_tier"":""default"",""system_fingerprint"":null,""usage"":{""completion_tokens"":63,""prompt_tokens"":539,""total_tokens"":602,""completion_tokens_details"":{""accepted_prediction_tokens"":0,""audio_tokens"":0,""reasoning_tokens"":0,""rejected_prediction_tokens"":0},""prompt_tokens_details"":{""audio_tokens"":0,""cached_tokens"":0}}}",602,539,--,user-provided,63,--,user-provided,OK
ChatCompletion,LLM,OK,2025-08-11T23:59:53.605Z,,4006.704,55bc775245169153020e0ae99874bb17,ad91c04010854229,,LLM,770,"{""messages"": [{""role"": ""system"", ""content"": ""You are an expert at classifying user intents for a travel planning assistant.\n\nAvailable intent categories:\n- flight_only: User wants flight search/booking only\n- hotel_only: User wants hotel search/booking only  \n- full_trip: User wants complete trip planning (flights + hotels + itinerary)\n- information: User wants general travel information (weather, events, etc.)\n- greeting: User is greeting or starting conversation\n- clarification_needed: Request is too vague and needs more information\n- unknown: Cannot determine intent\n\nYour task is to:\n1. Classify the user's intent\n2. Extract relevant entities (dates, locations, preferences, etc.)\n3. Provide confidence score (0.0-1.0)\n4. Give reasoning for your classification\n5. Suggest follow-up questions if clarification is needed\n\nPrevious conversation context:\nAssistant: I'd like to help you with your travel plans, but I need a bit more information. Do you need help with booking flights, hotels, or both?\nUser: Both\nAssistant: I'd love to help you plan a complete trip! I need some details: destination, departure city, travel dates. Could you provide this information?\nUser: Destination Tokyo, Departure city New york on 8/28 for a week\n\n\nClassification examples:\nExample 1:\nInput: I need to book a flight from New York to Los Angeles next week\nOutput: {\""intent\"": \""flight_only\"", \""confidence\"": 0.95, \""entities\"": {\""origin\"": \""New York\"", \""destination\"": \""Los Angeles\"", \""time\"": \""next week\""}}\n\nExample 2:\nInput: Find me a hotel in San Francisco for 3 nights in December\nOutput: {\""intent\"": \""hotel_only\"", \""confidence\"": 0.92, \""entities\"": {\""location\"": \""San Francisco\"", \""duration\"": \""3 nights\"", \""time\"": \""December\""}}\n\nExample 3:\nInput: Plan a complete trip to Europe including flights and hotels\nOutput: {\""intent\"": \""full_trip\"", \""confidence\"": 0.98, \""entities\"": {\""destination\"": \""Europe\"", \""includes\"": [\""flights\"", \""hotels\""]}}\n\nExample 4:\nInput: What's the weather like in Tokyo in March?\nOutput: {\""intent\"": \""information\"", \""confidence\"": 0.89, \""entities\"": {\""location\"": \""Tokyo\"", \""topic\"": \""weather\"", \""time\"": \""March\""}}\n\nExample 5:\nInput: Hello, I'm looking for travel help\nOutput: {\""intent\"": \""greeting\"", \""confidence\"": 0.85, \""entities\"": {\""topic\"": \""travel\""}}\n\n\n\nRespond with valid JSON in this exact format:\n{\n    \""intent\"": \""intent_name\"",\n    \""confidence\"": 0.95,\n    \""entities\"": {\n        \""key\"": \""value\""\n    },\n    \""reasoning\"": \""Brief explanation of classification\"",\n    \""follow_up_questions\"": [\""question1\"", \""question2\""]\n}""}, {""role"": ""user"", ""content"": ""Classify this user message: Destination Tokyo, Departure city New york on 8/28 for a week""}], ""model"": ""gpt-4"", ""max_tokens"": 500, ""temperature"": 0.1}","{""id"":""chatcmpl-C3WifKmH9uCaxcrPu2lieEskwcyGy"",""choices"":[{""finish_reason"":""stop"",""index"":0,""logprobs"":null,""message"":{""content"":""{\n    \""intent\"": \""full_trip\"",\n    \""confidence\"": 0.98,\n    \""entities\"": {\n        \""destination\"": \""Tokyo\"",\n        \""departure_city\"": \""New York\"",\n        \""start_date\"": \""8/28\"",\n        \""duration\"": \""1 week\""\n    },\n    \""reasoning\"": \""The user has provided information about both flight and hotel booking, indicating a full trip planning. The user has mentioned the destination, departure city, and travel dates.\"",\n    \""follow_up_questions\"": [\""Do you have any preferences for your hotel?\"", \""Do you prefer a direct flight or are you open to layovers?\""]\n}"",""refusal"":null,""role"":""assistant"",""annotations"":[]}}],""created"":1754956793,""model"":""gpt-4-0613"",""object"":""chat.completion"",""service_tier"":""default"",""system_fingerprint"":null,""usage"":{""completion_tokens"":131,""prompt_tokens"":639,""total_tokens"":770,""completion_tokens_details"":{""accepted_prediction_tokens"":0,""audio_tokens"":0,""reasoning_tokens"":0,""rejected_prediction_tokens"":0},""prompt_tokens_details"":{""audio_tokens"":0,""cached_tokens"":0}}}",770,639,--,user-provided,131,--,user-provided,OK
ChatCompletion,LLM,OK,2025-08-11T23:59:24.394Z,,4294.298,148eeed08af3f852c4e5bf494998f982,74096cc2bae1d203,,LLM,732,"{""messages"": [{""role"": ""system"", ""content"": ""You are an expert at classifying user intents for a travel planning assistant.\n\nAvailable intent categories:\n- flight_only: User wants flight search/booking only\n- hotel_only: User wants hotel search/booking only  \n- full_trip: User wants complete trip planning (flights + hotels + itinerary)\n- information: User wants general travel information (weather, events, etc.)\n- greeting: User is greeting or starting conversation\n- clarification_needed: Request is too vague and needs more information\n- unknown: Cannot determine intent\n\nYour task is to:\n1. Classify the user's intent\n2. Extract relevant entities (dates, locations, preferences, etc.)\n3. Provide confidence score (0.0-1.0)\n4. Give reasoning for your classification\n5. Suggest follow-up questions if clarification is needed\n\nPrevious conversation context:\nAssistant: I'd like to help you with your travel plans, but I need a bit more information. Do you need help with booking flights, hotels, or both? When are you planning to travel? How long do you plan to stay in Tokyo?\nUser: I wanna go there for a week departing on 8/28\nAssistant: I'd like to help you with your travel plans, but I need a bit more information. Do you need help with booking flights, hotels, or both?\nUser: Both\n\n\nClassification examples:\nExample 1:\nInput: I need to book a flight from New York to Los Angeles next week\nOutput: {\""intent\"": \""flight_only\"", \""confidence\"": 0.95, \""entities\"": {\""origin\"": \""New York\"", \""destination\"": \""Los Angeles\"", \""time\"": \""next week\""}}\n\nExample 2:\nInput: Find me a hotel in San Francisco for 3 nights in December\nOutput: {\""intent\"": \""hotel_only\"", \""confidence\"": 0.92, \""entities\"": {\""location\"": \""San Francisco\"", \""duration\"": \""3 nights\"", \""time\"": \""December\""}}\n\nExample 3:\nInput: Plan a complete trip to Europe including flights and hotels\nOutput: {\""intent\"": \""full_trip\"", \""confidence\"": 0.98, \""entities\"": {\""destination\"": \""Europe\"", \""includes\"": [\""flights\"", \""hotels\""]}}\n\nExample 4:\nInput: What's the weather like in Tokyo in March?\nOutput: {\""intent\"": \""information\"", \""confidence\"": 0.89, \""entities\"": {\""location\"": \""Tokyo\"", \""topic\"": \""weather\"", \""time\"": \""March\""}}\n\nExample 5:\nInput: Hello, I'm looking for travel help\nOutput: {\""intent\"": \""greeting\"", \""confidence\"": 0.85, \""entities\"": {\""topic\"": \""travel\""}}\n\n\n\nRespond with valid JSON in this exact format:\n{\n    \""intent\"": \""intent_name\"",\n    \""confidence\"": 0.95,\n    \""entities\"": {\n        \""key\"": \""value\""\n    },\n    \""reasoning\"": \""Brief explanation of classification\"",\n    \""follow_up_questions\"": [\""question1\"", \""question2\""]\n}""}, {""role"": ""user"", ""content"": ""Classify this user message: Both""}], ""model"": ""gpt-4"", ""max_tokens"": 500, ""temperature"": 0.1}","{""id"":""chatcmpl-C3WiDTY8L4VSu1aSWDpVjAdTPtned"",""choices"":[{""finish_reason"":""stop"",""index"":0,""logprobs"":null,""message"":{""content"":""{\n    \""intent\"": \""full_trip\"",\n    \""confidence\"": 0.95,\n    \""entities\"": {\n        \""includes\"": [\""flights\"", \""hotels\""]\n    },\n    \""reasoning\"": \""The user has indicated that they need help with both flights and hotels, which suggests they want a full trip planned.\"",\n    \""follow_up_questions\"": [\""What is your destination?\"", \""Do you have any preferences for your flight or hotel?\""]\n}"",""refusal"":null,""role"":""assistant"",""annotations"":[]}}],""created"":1754956765,""model"":""gpt-4-0613"",""object"":""chat.completion"",""service_tier"":""default"",""system_fingerprint"":null,""usage"":{""completion_tokens"":92,""prompt_tokens"":640,""total_tokens"":732,""completion_tokens_details"":{""accepted_prediction_tokens"":0,""audio_tokens"":0,""reasoning_tokens"":0,""rejected_prediction_tokens"":0},""prompt_tokens_details"":{""audio_tokens"":0,""cached_tokens"":0}}}",732,640,--,user-provided,92,--,user-provided,OK
ChatCompletion,LLM,OK,2025-08-11T23:59:16.703Z,,2965.381,73a7564c88e6ab3a0a9505f224df82df,50034638e34e05cc,,LLM,768,"{""messages"": [{""role"": ""system"", ""content"": ""You are an expert at classifying user intents for a travel planning assistant.\n\nAvailable intent categories:\n- flight_only: User wants flight search/booking only\n- hotel_only: User wants hotel search/booking only  \n- full_trip: User wants complete trip planning (flights + hotels + itinerary)\n- information: User wants general travel information (weather, events, etc.)\n- greeting: User is greeting or starting conversation\n- clarification_needed: Request is too vague and needs more information\n- unknown: Cannot determine intent\n\nYour task is to:\n1. Classify the user's intent\n2. Extract relevant entities (dates, locations, preferences, etc.)\n3. Provide confidence score (0.0-1.0)\n4. Give reasoning for your classification\n5. Suggest follow-up questions if clarification is needed\n\nPrevious conversation context:\nAssistant: I'd like to help you with your travel plans, but I need a bit more information. Can you please provide more details? Are you looking for flight or hotel information? Do you need information about a specific location?\nUser: Yeah I wanna travel to Tokyo\nAssistant: I'd like to help you with your travel plans, but I need a bit more information. Do you need help with booking flights, hotels, or both? When are you planning to travel? How long do you plan to stay in Tokyo?\nUser: I wanna go there for a week departing on 8/28\n\n\nClassification examples:\nExample 1:\nInput: I need to book a flight from New York to Los Angeles next week\nOutput: {\""intent\"": \""flight_only\"", \""confidence\"": 0.95, \""entities\"": {\""origin\"": \""New York\"", \""destination\"": \""Los Angeles\"", \""time\"": \""next week\""}}\n\nExample 2:\nInput: Find me a hotel in San Francisco for 3 nights in December\nOutput: {\""intent\"": \""hotel_only\"", \""confidence\"": 0.92, \""entities\"": {\""location\"": \""San Francisco\"", \""duration\"": \""3 nights\"", \""time\"": \""December\""}}\n\nExample 3:\nInput: Plan a complete trip to Europe including flights and hotels\nOutput: {\""intent\"": \""full_trip\"", \""confidence\"": 0.98, \""entities\"": {\""destination\"": \""Europe\"", \""includes\"": [\""flights\"", \""hotels\""]}}\n\nExample 4:\nInput: What's the weather like in Tokyo in March?\nOutput: {\""intent\"": \""information\"", \""confidence\"": 0.89, \""entities\"": {\""location\"": \""Tokyo\"", \""topic\"": \""weather\"", \""time\"": \""March\""}}\n\nExample 5:\nInput: Hello, I'm looking for travel help\nOutput: {\""intent\"": \""greeting\"", \""confidence\"": 0.85, \""entities\"": {\""topic\"": \""travel\""}}\n\n\n\nRespond with valid JSON in this exact format:\n{\n    \""intent\"": \""intent_name\"",\n    \""confidence\"": 0.95,\n    \""entities\"": {\n        \""key\"": \""value\""\n    },\n    \""reasoning\"": \""Brief explanation of classification\"",\n    \""follow_up_questions\"": [\""question1\"", \""question2\""]\n}""}, {""role"": ""user"", ""content"": ""Classify this user message: I wanna go there for a week departing on 8/28""}], ""model"": ""gpt-4"", ""max_tokens"": 500, ""temperature"": 0.1}","{""id"":""chatcmpl-C3Wi57RMSyEQO9EzX3E2ploHoOQII"",""choices"":[{""finish_reason"":""stop"",""index"":0,""logprobs"":null,""message"":{""content"":""{\n    \""intent\"": \""clarification_needed\"",\n    \""confidence\"": 0.6,\n    \""entities\"": {\n        \""duration\"": \""a week\"",\n        \""departure_date\"": \""8/28\""\n    },\n    \""reasoning\"": \""While the user has provided their travel dates and duration, they have not specified whether they need help with flights, hotels, or both.\"",\n    \""follow_up_questions\"": [\""Do you need help with booking flights, hotels, or both?\""]\n}"",""refusal"":null,""role"":""assistant"",""annotations"":[]}}],""created"":1754956757,""model"":""gpt-4-0613"",""object"":""chat.completion"",""service_tier"":""default"",""system_fingerprint"":null,""usage"":{""completion_tokens"":99,""prompt_tokens"":669,""total_tokens"":768,""completion_tokens_details"":{""accepted_prediction_tokens"":0,""audio_tokens"":0,""reasoning_tokens"":0,""rejected_prediction_tokens"":0},""prompt_tokens_details"":{""audio_tokens"":0,""cached_tokens"":0}}}",768,669,--,user-provided,99,--,user-provided,OK
